{
  "$schema": "https://json-schema.org/draft/2020-12/schema",
  "$id": "https://forgerems.local/schemas/forgerems.updates.schema.json",
  "title": "ForgerEMS Ventoy Core Manifest",
  "type": "object",
  "required": [
    "items"
  ],
  "properties": {
    "$schema": {
      "type": "string"
    },
    "coreName": {
      "type": "string",
      "minLength": 1
    },
    "coreVersion": {
      "type": "string",
      "minLength": 1
    },
    "buildTimestampUtc": {
      "type": "string",
      "minLength": 1
    },
    "releaseType": {
      "type": "string",
      "enum": [
        "dev",
        "candidate",
        "stable"
      ]
    },
    "managedChecksumPolicy": {
      "type": "string",
      "enum": [
        "warn",
        "require-for-release"
      ]
    },
    "manifestVersion": {
      "type": "integer",
      "minimum": 1
    },
    "settings": {
      "type": "object",
      "properties": {
        "downloadFolder": {
          "type": "string",
          "minLength": 1
        },
        "archiveFolder": {
          "type": "string",
          "minLength": 1
        },
        "logFolder": {
          "type": "string",
          "minLength": 1
        },
        "timeoutSec": {
          "type": "integer",
          "minimum": 1
        },
        "retryCount": {
          "type": "integer",
          "minimum": 1
        },
        "userAgent": {
          "type": "string",
          "minLength": 1
        },
        "maxArchivePerItem": {
          "type": "integer",
          "minimum": 1
        }
      },
      "additionalProperties": true
    },
    "items": {
      "type": "array",
      "minItems": 1,
      "items": {
        "type": "object",
        "required": [
          "name",
          "url",
          "dest"
        ],
        "properties": {
          "name": {
            "type": "string",
            "minLength": 1
          },
          "type": {
            "type": "string",
            "enum": [
              "file",
              "page"
            ]
          },
          "dest": {
            "type": "string",
            "minLength": 1
          },
          "url": {
            "type": "string",
            "minLength": 1
          },
          "sha256": {
            "type": "string",
            "pattern": "^[A-Fa-f0-9]{64}$"
          },
          "sha256Url": {
            "type": "string",
            "minLength": 1
          },
          "sha512": {
            "type": "string",
            "pattern": "^[A-Fa-f0-9]{128}$"
          },
          "sha512Url": {
            "type": "string",
            "minLength": 1
          },
          "sourceType": {
            "type": "string",
            "enum": [
              "sourceforge",
              "github-release",
              "official-mirror",
              "official-version-path"
            ]
          },
          "fragilityLevel": {
            "type": "string",
            "enum": [
              "low",
              "medium",
              "high"
            ]
          },
          "fallbackRule": {
            "type": "string",
            "minLength": 1
          },
          "maintenanceRank": {
            "type": "integer",
            "minimum": 1
          },
          "borderline": {
            "type": "boolean"
          },
          "enabled": {
            "type": "boolean"
          },
          "archive": {
            "type": "boolean"
          },
          "timeoutSec": {
            "type": "integer",
            "minimum": 1
          },
          "notes": {
            "type": "string"
          },
          "kind": {
            "type": "string",
            "enum": [
              "os",
              "tool",
              "driver-shortcut",
              "runtime",
              "browser"
            ],
            "description": "Catalog classification. 'os' marks operating system / installer media entries; 'tool' marks technician utilities. Optional and additive; legacy items without this field default to 'tool' for behavioural purposes."
          },
          "family": {
            "type": "string",
            "description": "OS family or tool family. Examples: Windows, Linux, BSD, Other-Unix, Hobby, Recovery, Server, Network-Appliance, Hypervisor, Forensic, Security, DOS."
          },
          "osCategory": {
            "type": "string",
            "description": "OS-only sub-category. Examples: Desktop, Server, Recovery, Forensic, Security, Legacy, Hobby, Live, Hypervisor."
          },
          "architecture": {
            "description": "Architecture(s) the entry targets. Either a single token (e.g. 'amd64') or an array of tokens (e.g. ['amd64','arm64']). Common tokens: amd64, x86, arm64, armhf, i386.",
            "oneOf": [
              {
                "type": "string",
                "minLength": 1
              },
              {
                "type": "array",
                "items": {
                  "type": "string",
                  "minLength": 1
                },
                "minItems": 1
              }
            ]
          },
          "bootMode": {
            "description": "Boot firmware support. Common tokens: bios, uefi, secure-boot, secure-boot-not-supported, legacy-only. Multiple values allowed via an array.",
            "oneOf": [
              {
                "type": "string",
                "minLength": 1
              },
              {
                "type": "array",
                "items": {
                  "type": "string",
                  "minLength": 1
                },
                "minItems": 1
              }
            ]
          },
          "recommendedUse": {
            "type": "string",
            "description": "Short technician-facing line describing when to reach for this catalog item."
          },
          "technicianNotes": {
            "type": "string",
            "description": "Longer technician note: gotchas, install caveats, hardware quirks."
          },
          "licenseNote": {
            "type": "string",
            "description": "Plain-English license note. Examples: 'Free / open source', 'Microsoft EULA', 'Paid - vendor licence required', 'Free for personal use', 'Discontinued / unsupported by vendor'."
          },
          "manualOnly": {
            "type": "boolean",
            "description": "True when the item must be obtained manually by the user. Redundant with 'type=page' but useful for explicit catalog filters."
          },
          "legacyWarning": {
            "type": "string",
            "description": "Plain-English warning shown for unsupported / end-of-life / hobby / lab-only catalog items."
          },
          "ventoyNotes": {
            "type": "string",
            "description": "Ventoy-specific compatibility note. Examples: 'Boot via legacy BIOS only', 'May require persistence file', 'Use ventoy.json plugin'."
          },
          "secureBootNote": {
            "type": "string",
            "description": "Secure Boot status note. Examples: 'Secure Boot supported', 'Secure Boot may need to be disabled', 'Unsigned bootloader - Secure Boot must be disabled'."
          },
          "sourceTrust": {
            "type": "string",
            "enum": [
              "official",
              "community",
              "manual"
            ],
            "description": "Trust level of the upstream URL. 'official' = vendor/project page. 'community' = trusted community distribution. 'manual' = no automated provenance."
          },
          "downloadMode": {
            "type": "string",
            "enum": [
              "ManagedDownload",
              "OfficialDownloadPage",
              "ManualMediaRequired",
              "ReviewFirst",
              "VendorPortal",
              "LicenseRestricted",
              "DynamicMirrorOnly",
              "OEMSpecific",
              "FirmwareBlocked",
              "CommunityToolkit",
              "Unsupported",
              "InfoOnly"
            ],
            "description": "First-class technician action mode. Optional for backward compatibility; legacy manifests infer from type/manualOnly/kind/sourceTrust/notes."
          },
          "resourceId": {
            "type": "string",
            "minLength": 1,
            "description": "Stable resource id in manifests/resource-policy.json. Required when requiresResolution is true; overlays bind by this id, never by display name."
          },
          "requiresResolution": {
            "type": "boolean",
            "description": "True when the item's artifact URL and expected SHA-256 must be resolved at runtime from the resource policy overlay before any download. Such items carry no static checksum; a fresh verified overlay entry is required."
          },
          "resolveStrategy": {
            "type": "string",
            "enum": [
              "pinned",
              "github-stable",
              "checksum-index",
              "ubuntu-lts",
              "official-page",
              "github-latest",
              "sourceforge-project",
              "directory-scan"
            ],
            "description": "Metadata resolution strategy. Provider names (github-stable/checksum-index/ubuntu-lts/official-page) bind to manifests/resource-policy.json; legacy strategies are retained for backward compatibility."
          },
          "actionLabel": {
            "type": "string",
            "description": "Optional primary technician-facing action label. When absent, UI derives a label from downloadMode."
          },
          "secondaryActionLabel": {
            "type": "string",
            "description": "Optional secondary technician-facing action label."
          },
          "actionReason": {
            "type": "string",
            "description": "Short explanation for why this action mode was selected."
          },
          "promotionStatus": {
            "type": "string",
            "description": "Promotion audit status such as promoted, kept page-only, blocked, or needs human review."
          },
          "promotionEvidence": {
            "type": "string",
            "description": "Official evidence supporting the mode: checksum source, signature, portal reason, or legal/manual blocker."
          },
          "legalRisk": {
            "type": "string",
            "description": "Plain-English legal or licensing risk summary."
          },
          "checksumRequirement": {
            "type": "string",
            "description": "Checksum/signature requirement for promotion or continued managed download eligibility."
          },
          "managedPromotionCandidate": {
            "type": "boolean",
            "description": "True when this page entry looks like a future managed candidate but is intentionally not promoted yet."
          },
          "freshness": {
            "type": "object",
            "description": "Catalog freshness intelligence. All fields are optional and informational. ForgerEMS never auto-upgrades based on this metadata; it only surfaces review actions for the technician. Missing or stale freshness data is treated as ManualReviewRequired by the audit helper.",
            "properties": {
              "currentPinnedVersion": {
                "type": "string",
                "description": "The pinned upstream version this catalog entry references (e.g., '4.6.6', '1.26.24', '24.04.4'). Should match the version embedded in 'url' and 'name'."
              },
              "latestKnownStableVersion": {
                "type": "string",
                "description": "The latest stable version observed at the last freshness audit. Never a beta/RC/nightly value."
              },
              "lastFreshnessAuditUtc": {
                "type": "string",
                "minLength": 1,
                "description": "ISO-8601 UTC timestamp of the last freshness audit (e.g., '2026-05-21T00:00:00Z'). Stale timestamps trigger ManualReviewRequired."
              },
              "freshnessStatus": {
                "type": "string",
                "enum": [
                  "UpToDate",
                  "PatchUpdateAvailable",
                  "MinorUpdateAvailable",
                  "MajorUpdateAvailable",
                  "ManualReviewRequired",
                  "ChecksumVerificationRequired",
                  "SourceChanged",
                  "UpdateUnsafe",
                  "LegacyPinned",
                  "VendorWorkflowChanged"
                ],
                "description": "Classification result. 'ManualReviewRequired' is the safe default for any entry whose upstream could not be checked live."
              },
              "updateChannel": {
                "type": "string",
                "enum": [
                  "stable",
                  "LTS",
                  "ESR",
                  "manual-only",
                  "legacy-pinned"
                ],
                "description": "Update channel the entry tracks. ForgerEMS does NOT support beta/nightly/RC channels by default."
              },
              "requiresManualReview": {
                "type": "boolean",
                "description": "True when an operator must inspect this entry before any version change."
              },
              "majorVersionBoundary": {
                "type": "boolean",
                "description": "True when latestKnownStableVersion crosses a major-version boundary above currentPinnedVersion. Major boundaries always require manual review."
              },
              "checksumVerificationMode": {
                "type": "string",
                "enum": [
                  "sha256-pinned",
                  "sha256url-only",
                  "sha512-pinned",
                  "sha512url-only",
                  "github-asset-digest",
                  "manual",
                  "unverified"
                ],
                "description": "How the checksum is verified at download time."
              },
              "upstreamReleaseType": {
                "type": "string",
                "enum": [
                  "github-releases",
                  "vendor-version-page",
                  "vendor-rss",
                  "sourceforge-rss",
                  "official-mirror-index",
                  "manual"
                ],
                "description": "Shape of the upstream release discovery. 'manual' means a human must check the vendor."
              },
              "lastKnownChecksumSource": {
                "type": "string",
                "description": "Mirror or description of where the checksum was last fetched from (e.g. the sha256Url, a GitHub digest endpoint, or 'operator-paste from vendor SHA256SUMS')."
              },
              "updateRecommendation": {
                "type": "string",
                "description": "Short technician-facing recommendation. Plain English, not a directive: e.g. 'Review release notes before bumping' or 'Patch update is safe to promote in next batch'."
              }
            },
            "additionalProperties": false
          }
        },
        "allOf": [
          {
            "if": {
              "properties": {
                "type": {
                  "const": "page"
                }
              },
              "required": [
                "type"
              ]
            },
            "then": {
              "not": {
                "anyOf": [
                  {
                    "required": [
                      "sha256Url"
                    ]
                  },
                  {
                    "required": [
                      "sha512Url"
                    ]
                  }
                ]
              }
            }
          },
          {
            "if": {
              "properties": {
                "type": {
                  "const": "page"
                }
              },
              "required": [
                "type"
              ]
            },
            "then": {
              "not": {
                "anyOf": [
                  {
                    "required": [
                      "sourceType"
                    ]
                  },
                  {
                    "required": [
                      "fragilityLevel"
                    ]
                  },
                  {
                    "required": [
                      "maintenanceRank"
                    ]
                  },
                  {
                    "required": [
                      "borderline"
                    ]
                  }
                ]
              }
            }
          }
        ],
        "additionalProperties": true
      }
    }
  },
  "additionalProperties": true
}
