{
  "coreName": "ForgerEMS Ventoy Core",
  "coreVersion": "2026.04.20.2",
  "buildTimestampUtc": "2026-04-20T21:27:43Z",
  "releaseType": "stable",
  "managedChecksumPolicy": "require-for-release",
  "manifestVersion": 1,
  "settings": {
    "downloadFolder": "_downloads",
    "archiveFolder": "_archive",
    "logFolder": "_logs",
    "timeoutSec": 600,
    "retryCount": 3,
    "userAgent": "ForgerEMS-Updater/3.1",
    "maxArchivePerItem": 5
  },
  "items": [
    {
      "name": "SystemRescue 13.00 (amd64)",
      "type": "file",
      "dest": "ISO\\Linux\\systemrescue-13.00-amd64.iso",
      "url": "https://sourceforge.net/projects/systemrescuecd/files/sysresccd-x86/13.00/systemrescue-13.00-amd64.iso/download",
      "sha256Url": "https://www.system-rescue.org/releases/13.00/systemrescue-13.00-amd64.iso.sha256",
      "sourceType": "sourceforge",
      "fragilityLevel": "high",
      "fallbackRule": "Re-derive the same versioned ISO from the official SystemRescue download page and keep the official checksum source. Demote if only mirror-style paths or no official checksum remain.",
      "maintenanceRank": 4,
      "enabled": true,
      "archive": true,
      "notes": "Active managed autodownload: Linux recovery environment."
    },
    {
      "name": "GParted Live 1.8.1-3 (amd64)",
      "type": "file",
      "dest": "ISO\\Tools\\gparted-live-1.8.1-3-amd64.iso",
      "url": "https://sourceforge.net/projects/gparted/files/gparted-live-stable/1.8.1-3/gparted-live-1.8.1-3-amd64.iso/download",
      "sha256": "3f66b2e10b8bb2c573ed6cdd3a9b54fd0a8e7690634ab6b15c3c8f517992d1a1",
      "sourceType": "sourceforge",
      "fragilityLevel": "high",
      "fallbackRule": "Re-derive the same versioned ISO from gparted.org and refresh the pinned checksum from an official project checksum or source. Demote if only page flows or unverified mirrors remain.",
      "maintenanceRank": 5,
      "enabled": true,
      "archive": true,
      "notes": "Active managed autodownload: partition editor live ISO."
    },
    {
      "name": "Clonezilla Live 3.3.1-35 (amd64)",
      "type": "file",
      "dest": "ISO\\Tools\\clonezilla-live-3.3.1-35-amd64.iso",
      "url": "https://sourceforge.net/projects/clonezilla/files/clonezilla_live_stable/3.3.1-35/clonezilla-live-3.3.1-35-amd64.iso/download",
      "sha256": "ac4f88c8795a917e3d3fc1a3e52d095f35fe531d459cf853cd3e2c7731043fec",
      "sourceType": "sourceforge",
      "fragilityLevel": "high",
      "fallbackRule": "Re-derive the same versioned ISO from the official Clonezilla download page and refresh the pinned checksum from an official project checksum or source. Demote if only mirrors or page-only flows remain.",
      "maintenanceRank": 6,
      "enabled": true,
      "archive": true,
      "notes": "Active managed autodownload: disk imaging / cloning live ISO."
    },
    {
      "name": "Rescuezilla 2.6.1 (64-bit oracular)",
      "type": "file",
      "dest": "ISO\\Tools\\rescuezilla-2.6.1-64bit.oracular.iso",
      "url": "https://github.com/rescuezilla/rescuezilla/releases/download/2.6.1/rescuezilla-2.6.1-64bit.oracular.iso",
      "sha256": "7eaa7318634d4831d9bdf2b683acdcd68fb8dd42835fee0db8cb908ddfed2c74",
      "sha256Url": "https://github.com/rescuezilla/rescuezilla/releases/download/2.6.1/SHA256SUM",
      "sourceType": "github-release",
      "fragilityLevel": "medium",
      "fallbackRule": "Use rescuezilla.com or the matching official GitHub release for the same version and keep the SHA256SUM coverage. Demote if the release asset or checksum file stops matching.",
      "maintenanceRank": 13,
      "enabled": true,
      "archive": true,
      "notes": "Active managed autodownload: GUI rescue/backup imaging ISO."
    },

    {
      "name": "Ventoy 1.1.11 (Windows package)",
      "type": "file",
      "dest": "Tools\\Portable\\USB\\ventoy-1.1.11-windows.zip",
      "url": "https://sourceforge.net/projects/ventoy/files/v1.1.11/ventoy-1.1.11-windows.zip/download",
      "sha256": "1e56e02fc424c194fc4f33357cb949867854f386d67eaf9764f1c96264561493",
      "sha256Url": "https://sourceforge.net/projects/ventoy/files/v1.1.11/sha256.txt/download",
      "sourceType": "sourceforge",
      "fragilityLevel": "high",
      "fallbackRule": "Use ventoy.net to confirm the same versioned SourceForge asset and keep the official checksum file. Demote if the path stops being a direct official artifact or checksum coverage disappears.",
      "maintenanceRank": 3,
      "enabled": true,
      "archive": true,
      "notes": "Active managed autodownload: official Ventoy Windows package. Ventoy2Disk installation is still a manual step."
    },
    {
      "name": "MediCat Download Page",
      "type": "page",
      "dest": "MediCat.USB\\DOWNLOAD - MediCat.url",
      "url": "https://medicatusb.com/",
      "enabled": true,
      "notes": "Manual only: large community toolkit."
    },

    {
      "name": "Windows 11 Download Page",
      "type": "page",
      "dest": "ISO\\Windows\\DOWNLOAD - Windows 11.url",
      "url": "https://www.microsoft.com/software-download/windows11",
      "enabled": true,
      "notes": "Manual only: Microsoft official download flow."
    },
    {
      "name": "Windows 10 Download Page",
      "type": "page",
      "dest": "ISO\\Windows\\DOWNLOAD - Windows 10.url",
      "url": "https://www.microsoft.com/software-download/windows10ISO",
      "enabled": true,
      "notes": "Manual only: Microsoft official download flow."
    },
    {
      "name": "Sergei Strelec WinPE Info",
      "type": "page",
      "dest": "ISO\\Windows\\INFO - WinPE (Sergei Strelec).url",
      "url": "https://sergeistrelec.name/",
      "enabled": true,
      "notes": "Manual only: community WinPE project."
    },

    {
      "name": "Hiren's BootCD PE Download Page",
      "type": "page",
      "dest": "ISO\\Tools\\DOWNLOAD - Hiren's BootCD PE.url",
      "url": "https://www.hirensbootcd.org/download/",
      "enabled": true,
      "notes": "Review first: keep the official page shortcut until provenance and redistribution review is settled."
    },
    {
      "name": "Clonezilla Download Page",
      "type": "page",
      "dest": "ISO\\Tools\\DOWNLOAD - Clonezilla.url",
      "url": "https://clonezilla.org/downloads.php",
      "enabled": true,
      "notes": "Info shortcut: upstream page for the active managed autodownload Clonezilla ISO."
    },
    {
      "name": "Rescuezilla Download Page",
      "type": "page",
      "dest": "ISO\\Tools\\DOWNLOAD - Rescuezilla.url",
      "url": "https://rescuezilla.com/download.html",
      "enabled": true,
      "notes": "Info shortcut: upstream page for the active managed autodownload Rescuezilla ISO."
    },
    {
      "name": "GParted Download Page",
      "type": "page",
      "dest": "ISO\\Tools\\DOWNLOAD - GParted.url",
      "url": "https://gparted.org/download.php",
      "enabled": true,
      "notes": "Info shortcut: upstream page for the active managed autodownload GParted ISO."
    },
    {
      "name": "MemTest86+ 8.00 (x86_64 ISO archive)",
      "type": "file",
      "dest": "ISO\\Tools\\mt86plus_8.00_x86_64.iso.zip",
      "url": "https://www.memtest.org/download/v8.00/mt86plus_8.00_x86_64.iso.zip",
      "sha256": "df242b91b55571d5126e8236ce7942851b7015331aaf48cfb440a8f9d2c4cc6f",
      "sha256Url": "https://www.memtest.org/download/v8.00/sha256sum.txt",
      "sourceType": "official-version-path",
      "fragilityLevel": "low",
      "fallbackRule": "Use the memtest.org versioned download directory and official sha256sum.txt for the same release. Demote if the workflow becomes page-only or checksum coverage disappears.",
      "maintenanceRank": 14,
      "enabled": true,
      "archive": true,
      "notes": "Active managed autodownload: official x86_64 ISO archive. Extract the ISO before using it with Ventoy."
    },
    {
      "name": "Ultimate Boot CD Download Page",
      "type": "page",
      "dest": "ISO\\Tools\\DOWNLOAD - Ultimate Boot CD.url",
      "url": "https://www.ultimatebootcd.com/download.html",
      "enabled": true,
      "notes": "Manual only: legacy diagnostic toolkit with mixed redistribution terms."
    },
    {
      "name": "MemTest86+ Download Page",
      "type": "page",
      "dest": "ISO\\Tools\\DOWNLOAD - MemTest86+.url",
      "url": "https://www.memtest.org/",
      "enabled": true,
      "notes": "Info shortcut: upstream page for the active managed autodownload MemTest86+ release."
    },

    {
      "name": "Ubuntu 24.04.4 LTS Desktop (amd64)",
      "type": "file",
      "dest": "ISO\\Linux\\ubuntu-24.04.4-desktop-amd64.iso",
      "url": "https://releases.ubuntu.com/24.04.4/ubuntu-24.04.4-desktop-amd64.iso",
      "sha256": "3a4c9877b483ab46d7c3fbe165a0db275e1ae3cfe56a5657e5a47c2f99a99d1e",
      "sourceType": "official-version-path",
      "fragilityLevel": "low",
      "fallbackRule": "Use the official Ubuntu release index for the same version and refresh the checksum from Canonical-published sums before patching. Demote if the versioned artifact is retired or no official sums remain.",
      "maintenanceRank": 16,
      "enabled": true,
      "archive": true,
      "notes": "Active managed autodownload: official Ubuntu desktop ISO."
    },
    {
      "name": "Linux Mint 22.3 Cinnamon (64-bit)",
      "type": "file",
      "dest": "ISO\\Linux\\linuxmint-22.3-cinnamon-64bit.iso",
      "url": "https://pub.linuxmint.io/stable/22.3/linuxmint-22.3-cinnamon-64bit.iso",
      "sha256": "a081ab202cfda17f6924128dbd2de8b63518ac0531bcfe3f1a1b88097c459bd4",
      "sourceType": "official-mirror",
      "fragilityLevel": "medium",
      "fallbackRule": "Move to a Linux Mint-controlled mirror or release page for the same version and refresh the checksum from the official mirror checksum file. Demote if only third-party mirrors remain.",
      "maintenanceRank": 7,
      "borderline": true,
      "enabled": true,
      "archive": true,